{
  "schema_version": "1",
  "analysis_id": "019a0000-0000-7000-8000-000000000001",
  "video_object_key": "analyses/019a0000-0000-7000-8000-000000000001/source/clear.mp4",
  "stroke": "overhead_clear",
  "handedness": "right",
  "view_hint": "rear_three_quarter",
  "pipeline_version": "2026.10.0"
}
